{"$schema":"https://json-schema.org/draft/2020-12/schema","additionalProperties":false,"properties":{"attendeesLimit":{"type":["integer","null"]},"description":{"type":["string","null"]},"eventFeeCurrency":{"type":["string","null"]},"eventFeeValue":{"type":["number","null"]},"guestsLimit":{"type":"integer"},"id":{"format":"uuid","type":"string"},"locationAddress":{"type":["string","null"]},"locationCity":{"type":["string","null"]},"locationName":{"type":["string","null"]},"locationPostalCode":{"type":["string","null"]},"meetingGroupId":{"format":"uuid","type":"string"},"rsvpTermEndDate":{"format":"date-time","type":["string","null"]},"rsvpTermStartDate":{"format":"date-time","type":["string","null"]},"termEndDate":{"format":"date-time","type":"string"},"termStartDate":{"format":"date-time","type":"string"},"title":{"type":["string","null"]}},"required":["guestsLimit","id","meetingGroupId","termEndDate","termStartDate"],"title":"MeetingDetailsDto","type":"object"}