{"attendeesLimit":50,"description":"Meeting about Tactical DDD patterns","eventFeeCurrency":null,"eventFeeValue":0,"guestsLimit":0,"id":"#GUID_0005#","locationAddress":"Location Address","locationCity":"Warsaw","locationName":"Location Name","locationPostalCode":"01-755","meetingGroupId":"#GUID_0004#","rsvpTermEndDate":"#TS#","rsvpTermStartDate":null,"termEndDate":"#TS#","termStartDate":"#TS#","title":"Tactical DDD"}